{
  "$schema": "http://json-schema.org/draft-07/schema#",
  "$id": "kccplugin/marketplace.schema.json",
  "title": "Claude Code Marketplace Manifest",
  "description": "Strict schema for .claude-plugin/marketplace.json. Fields beyond what is documented here will fail validation by design.",
  "type": "object",
  "additionalProperties": false,
  "required": ["name", "owner", "plugins"],
  "properties": {
    "name": {
      "type": "string",
      "pattern": "^[a-z0-9][a-z0-9-]*$",
      "minLength": 1,
      "maxLength": 64
    },
    "owner": {
      "type": "object",
      "additionalProperties": false,
      "required": ["name"],
      "properties": {
        "name": { "type": "string", "minLength": 1 },
        "email": { "type": "string", "format": "email" },
        "url": { "type": "string", "format": "uri" }
      }
    },
    "metadata": {
      "type": "object",
      "additionalProperties": false,
      "properties": {
        "description": { "type": "string" },
        "version": {
          "type": "string",
          "pattern": "^\\d+\\.\\d+\\.\\d+(?:-[0-9A-Za-z.-]+)?(?:\\+[0-9A-Za-z.-]+)?$"
        }
      }
    },
    "plugins": {
      "type": "array",
      "minItems": 1,
      "items": {
        "type": "object",
        "additionalProperties": false,
        "required": ["name", "source"],
        "properties": {
          "name": {
            "type": "string",
            "pattern": "^[a-z0-9][a-z0-9-]*$"
          },
          "source": {
            "oneOf": [
              { "type": "string", "minLength": 1 },
              {
                "type": "object",
                "additionalProperties": false,
                "required": ["source"],
                "properties": {
                  "source": {
                    "type": "string",
                    "enum": ["github", "git", "local"]
                  },
                  "repo": { "type": "string" },
                  "url": { "type": "string" },
                  "path": { "type": "string" },
                  "ref": { "type": "string" },
                  "branch": { "type": "string" },
                  "tag": { "type": "string" },
                  "commit": { "type": "string" }
                }
              }
            ]
          },
          "description": { "type": "string" },
          "version": {
            "type": "string",
            "pattern": "^\\d+\\.\\d+\\.\\d+(?:-[0-9A-Za-z.-]+)?(?:\\+[0-9A-Za-z.-]+)?$"
          },
          "category": { "type": "string" },
          "tags": {
            "type": "array",
            "items": { "type": "string" },
            "uniqueItems": true
          },
          "homepage": { "type": "string", "format": "uri" },
          "repository": { "type": "string" },
          "license": { "type": "string" },
          "author": {
            "type": "object",
            "additionalProperties": false,
            "properties": {
              "name": { "type": "string" },
              "email": { "type": "string", "format": "email" },
              "url": { "type": "string", "format": "uri" }
            }
          }
        }
      }
    }
  }
}
