{
  "name": "kccplugin",
  "owner": {
    "name": "koh"
  },
  "metadata": {
    "description": "A Claude Code plugin marketplace",
    "version": "0.2.0"
  },
  "plugins": [
    {
      "name": "kcc-core",
      "source": "./plugins/kcc-core",
      "description": "Core plugin: thinking & communication principles injected at session start, with a subagent variant injected into every spawned subagent.",
      "version": "0.4.0"
    },
    {
      "name": "kcc-dev-core",
      "source": "./plugins/kcc-dev-core",
      "description": "Development-focused plugin: conditionally injects code-discipline principles when the session is inside a software project (with a subagent variant injected into every spawned subagent), and hosts standalone dev skills (write-spec, write-blackbox-tests, materialize-blackbox-tests, write-unit-tests) and hooks.",
      "version": "0.10.0"
    }
  ]
}
